{
  "version": 2,
  "tool": "test-suite-doctor",
  "toolVersion": "0.2.0",
  "runId": "demo-synthetic",
  "createdAt": "2026-07-31T00:00:00.000Z",
  "cwd": "/demo/shop",
  "runner": "vitest",
  "granularity": "file",
  "options": {
    "synthetic": true
  },
  "scope": {
    "mode": "full",
    "filter": null,
    "testFiles": [
      "tests/cart.test.ts",
      "tests/cart-extra.test.ts",
      "tests/cart-should-work-2.test.ts",
      "tests/pricing.test.ts",
      "tests/pricing-more.test.ts",
      "tests/pricing-snapshot.test.ts",
      "tests/api.test.ts",
      "tests/api-mock.test.ts",
      "tests/api-contract.test.ts",
      "tests/utils-lodash.test.ts",
      "tests/regression-1042.test.ts",
      "tests/smoke.test.ts"
    ]
  },
  "environment": {
    "node": "synthetic",
    "platform": "darwin",
    "arch": "arm64",
    "runner": {
      "name": "vitest",
      "version": "synthetic",
      "executable": "synthetic"
    },
    "coverageProvider": {
      "name": "@vitest/coverage-v8",
      "version": "synthetic"
    }
  },
  "provenance": {
    "fingerprint": "synthetic-demo",
    "coveredSources": {
      "src/cart.ts": null,
      "src/pricing.ts": null,
      "src/api.ts": null
    },
    "configuration": {},
    "runtime": {
      "runner": {
        "name": "vitest",
        "version": "synthetic",
        "executable": "synthetic"
      },
      "coverageProvider": {
        "name": "@vitest/coverage-v8",
        "version": "synthetic"
      }
    },
    "git": {
      "commit": null,
      "branch": null,
      "dirty": null,
      "diffHash": null
    }
  },
  "baseline": {
    "totalTests": 17,
    "totalRuntimeMs": 4070,
    "wallMs": 14870,
    "coveredLines": 95,
    "totalLines": 103,
    "coveredBranches": 5,
    "totalBranches": 6
  },
  "baselineCoverage": {
    "src/cart.ts": {
      "lines": [
        1,
        2,
        3,
        4,
        5,
        6,
        7,
        8,
        9,
        10,
        11,
        12,
        13,
        14,
        15,
        16,
        17,
        18,
        19,
        20,
        21,
        22,
        23,
        24,
        25,
        26,
        27,
        28,
        29,
        30,
        31,
        32,
        33,
        34,
        35,
        36,
        37,
        38,
        39,
        40
      ],
      "branches": [
        "0.0",
        "0.1",
        "1.0"
      ]
    },
    "src/pricing.ts": {
      "lines": [
        1,
        2,
        3,
        4,
        5,
        6,
        7,
        8,
        9,
        10,
        11,
        12,
        13,
        14,
        15,
        16,
        17,
        18,
        19,
        20,
        21,
        22,
        23,
        24,
        25,
        26,
        27,
        28,
        29,
        30
      ],
      "branches": []
    },
    "src/api.ts": {
      "lines": [
        1,
        2,
        3,
        4,
        5,
        6,
        7,
        8,
        9,
        10,
        11,
        12,
        13,
        14,
        15,
        16,
        17,
        18,
        19,
        20,
        21,
        22,
        23,
        24,
        25
      ],
      "branches": [
        "0.0",
        "0.1"
      ]
    }
  },
  "collectionErrors": [],
  "units": [
    {
      "id": "tests/cart.test.ts",
      "file": "tests/cart.test.ts",
      "testName": null,
      "identity": {
        "file": "tests/cart.test.ts",
        "testName": null
      },
      "memberCount": 3,
      "tests": [
        {
          "fullName": "cart adds an item",
          "status": "passed",
          "durationMs": 283
        },
        {
          "fullName": "cart removes an item",
          "status": "passed",
          "durationMs": 283
        },
        {
          "fullName": "cart totals per currency",
          "status": "passed",
          "durationMs": 283
        }
      ],
      "runtimeMs": 850,
      "assertionMs": 850,
      "fileMs": 850,
      "optimizationMs": 850,
      "costSource": "runner-file",
      "wallMs": 1750,
      "status": "passed",
      "coverage": {
        "src/cart.ts": {
          "lines": [
            1,
            2,
            3,
            4,
            5,
            6,
            7,
            8,
            9,
            10,
            11,
            12,
            13,
            14,
            15,
            16,
            17,
            18,
            19,
            20,
            21,
            22,
            23,
            24,
            25,
            26,
            27,
            28,
            29,
            30,
            31,
            32,
            33,
            34,
            35,
            36,
            37,
            38
          ],
          "branches": [
            "0.0",
            "0.1"
          ]
        },
        "src/pricing.ts": {
          "lines": [
            1,
            2,
            3,
            4,
            5,
            6,
            7,
            8,
            9,
            10
          ],
          "branches": []
        }
      }
    },
    {
      "id": "tests/cart-extra.test.ts",
      "file": "tests/cart-extra.test.ts",
      "testName": null,
      "identity": {
        "file": "tests/cart-extra.test.ts",
        "testName": null
      },
      "memberCount": 2,
      "tests": [
        {
          "fullName": "cart should work",
          "status": "passed",
          "durationMs": 320
        },
        {
          "fullName": "cart should work correctly",
          "status": "passed",
          "durationMs": 320
        }
      ],
      "runtimeMs": 640,
      "assertionMs": 640,
      "fileMs": 640,
      "optimizationMs": 640,
      "costSource": "runner-file",
      "wallMs": 1540,
      "status": "passed",
      "coverage": {
        "src/cart.ts": {
          "lines": [
            1,
            2,
            3,
            4,
            5,
            6,
            7,
            8,
            9,
            10,
            11,
            12,
            13,
            14,
            15,
            16,
            17,
            18,
            19,
            20
          ],
          "branches": []
        }
      }
    },
    {
      "id": "tests/cart-should-work-2.test.ts",
      "file": "tests/cart-should-work-2.test.ts",
      "testName": null,
      "identity": {
        "file": "tests/cart-should-work-2.test.ts",
        "testName": null
      },
      "memberCount": 1,
      "tests": [
        {
          "fullName": "cart should return the correct value",
          "status": "passed",
          "durationMs": 610
        }
      ],
      "runtimeMs": 610,
      "assertionMs": 610,
      "fileMs": 610,
      "optimizationMs": 610,
      "costSource": "runner-file",
      "wallMs": 1510,
      "status": "passed",
      "coverage": {
        "src/cart.ts": {
          "lines": [
            1,
            2,
            3,
            4,
            5,
            6,
            7,
            8,
            9,
            10,
            11,
            12,
            13,
            14,
            15,
            16,
            17,
            18
          ],
          "branches": []
        }
      }
    },
    {
      "id": "tests/pricing.test.ts",
      "file": "tests/pricing.test.ts",
      "testName": null,
      "identity": {
        "file": "tests/pricing.test.ts",
        "testName": null
      },
      "memberCount": 2,
      "tests": [
        {
          "fullName": "applies the launch discount",
          "status": "passed",
          "durationMs": 160
        },
        {
          "fullName": "rounds half-up at two decimals",
          "status": "passed",
          "durationMs": 160
        }
      ],
      "runtimeMs": 320,
      "assertionMs": 320,
      "fileMs": 320,
      "optimizationMs": 320,
      "costSource": "runner-file",
      "wallMs": 1220,
      "status": "passed",
      "coverage": {
        "src/pricing.ts": {
          "lines": [
            1,
            2,
            3,
            4,
            5,
            6,
            7,
            8,
            9,
            10,
            11,
            12,
            13,
            14,
            15,
            16,
            17,
            18,
            19,
            20,
            21,
            22,
            23,
            24,
            25,
            26,
            27,
            28
          ],
          "branches": []
        }
      }
    },
    {
      "id": "tests/pricing-more.test.ts",
      "file": "tests/pricing-more.test.ts",
      "testName": null,
      "identity": {
        "file": "tests/pricing-more.test.ts",
        "testName": null
      },
      "memberCount": 1,
      "tests": [
        {
          "fullName": "discount should be defined",
          "status": "passed",
          "durationMs": 300
        }
      ],
      "runtimeMs": 300,
      "assertionMs": 300,
      "fileMs": 300,
      "optimizationMs": 300,
      "costSource": "runner-file",
      "wallMs": 1200,
      "status": "passed",
      "coverage": {
        "src/pricing.ts": {
          "lines": [
            1,
            2,
            3,
            4,
            5,
            6,
            7,
            8,
            9,
            10,
            11,
            12,
            13,
            14,
            15
          ],
          "branches": []
        }
      }
    },
    {
      "id": "tests/pricing-snapshot.test.ts",
      "file": "tests/pricing-snapshot.test.ts",
      "testName": null,
      "identity": {
        "file": "tests/pricing-snapshot.test.ts",
        "testName": null
      },
      "memberCount": 1,
      "tests": [
        {
          "fullName": "matches the pricing table snapshot",
          "status": "passed",
          "durationMs": 95
        }
      ],
      "runtimeMs": 95,
      "assertionMs": 95,
      "fileMs": 95,
      "optimizationMs": 95,